{
  "containers": {
    "haproxy": {
      "vmid": 175,
      "ip": "192.168.0.175",
      "hostname": "haproxy",
      "ansible_connection": "community.proxmox.proxmox_pct_remote",
      "ansible_pct_vmid": 175,
      "tags": [
        "terraform",
        "container",
        "haproxy",
        "pipeline",
        "infrastructure"
      ],
      "node": "pve",
      "pool_id": "homelab"
    },
    "cribl-edge-01": {
      "vmid": 180,
      "ip": "192.168.0.180",
      "hostname": "cribl-edge-01",
      "ansible_connection": "community.proxmox.proxmox_pct_remote",
      "ansible_pct_vmid": 180,
      "tags": [
        "terraform",
        "container",
        "cribl",
        "edge",
        "pipeline",
        "logging"
      ],
      "node": "pve",
      "pool_id": "homelab"
    },
    "cribl-edge-02": {
      "vmid": 181,
      "ip": "192.168.0.181",
      "hostname": "cribl-edge-02",
      "ansible_connection": "community.proxmox.proxmox_pct_remote",
      "ansible_pct_vmid": 181,
      "tags": [
        "terraform",
        "container",
        "cribl",
        "edge",
        "pipeline",
        "logging"
      ],
      "node": "pve",
      "pool_id": "homelab"
    },
    "mssql": {
      "vmid": 130,
      "ip": "192.168.0.130",
      "hostname": "mssql",
      "ansible_connection": "community.proxmox.proxmox_pct_remote",
      "ansible_pct_vmid": 130,
      "tags": [
        "database"
      ],
      "node": "pve",
      "pool_id": "homelab"
    },
    "cribl-stream-01": {
      "vmid": 182,
      "ip": "192.168.0.182",
      "hostname": "cribl-stream-01",
      "ansible_connection": "community.proxmox.proxmox_pct_remote",
      "ansible_pct_vmid": 182,
      "tags": [
        "terraform",
        "container",
        "cribl",
        "stream",
        "pipeline",
        "logging"
      ],
      "node": "pve",
      "pool_id": "homelab"
    },
    "cribl-stream-02": {
      "vmid": 183,
      "ip": "192.168.0.183",
      "hostname": "cribl-stream-02",
      "ansible_connection": "community.proxmox.proxmox_pct_remote",
      "ansible_pct_vmid": 183,
      "tags": [
        "terraform",
        "container",
        "cribl",
        "stream",
        "pipeline",
        "logging"
      ],
      "node": "pve",
      "pool_id": "homelab"
    },
    "apt-cacher-ng": {
      "vmid": 106,
      "ip": "192.168.0.106",
      "hostname": "apt-cacher-ng",
      "ansible_connection": "community.proxmox.proxmox_pct_remote",
      "ansible_pct_vmid": 106,
      "tags": [
        "apt-cache",
        "container",
        "infrastructure",
        "terraform"
      ],
      "node": "pve",
      "pool_id": "infrastructure"
    },
    "qdrant": {
      "vmid": 165,
      "ip": "192.168.0.165",
      "hostname": "qdrant",
      "ansible_connection": "community.proxmox.proxmox_pct_remote",
      "ansible_pct_vmid": 165,
      "tags": [
        "terraform",
        "container",
        "vectordb",
        "ai",
        "docker"
      ],
      "node": "pve",
      "pool_id": "ai"
    },
    "llamaindex": {
      "vmid": 166,
      "ip": "192.168.0.166",
      "hostname": "llamaindex",
      "ansible_connection": "community.proxmox.proxmox_pct_remote",
      "ansible_pct_vmid": 166,
      "tags": [
        "terraform",
        "container",
        "ai",
        "rag"
      ],
      "node": "pve",
      "pool_id": "ai"
    },
    "mailpit": {
      "vmid": 110,
      "ip": "192.168.0.110",
      "hostname": "mailpit",
      "ansible_connection": "community.proxmox.proxmox_pct_remote",
      "ansible_pct_vmid": 110,
      "tags": [
        "terraform",
        "container",
        "smtp",
        "notifications"
      ],
      "node": "pve",
      "pool_id": "homelab"
    },
    "ntfy": {
      "vmid": 111,
      "ip": "192.168.0.111",
      "hostname": "ntfy",
      "ansible_connection": "community.proxmox.proxmox_pct_remote",
      "ansible_pct_vmid": 111,
      "tags": [
        "terraform",
        "container",
        "push",
        "notifications"
      ],
      "node": "pve",
      "pool_id": "homelab"
    },
    "openproject": {
      "vmid": 140,
      "ip": "192.168.0.140",
      "hostname": "openproject",
      "ansible_connection": "community.proxmox.proxmox_pct_remote",
      "ansible_pct_vmid": 140,
      "tags": [
        "terraform",
        "container",
        "openproject",
        "projects",
        "docker"
      ],
      "node": "pve",
      "pool_id": "infrastructure"
    },
    "download-vpn": {
      "vmid": 210,
      "ip": "192.168.0.210",
      "hostname": "download-vpn",
      "ansible_connection": "community.proxmox.proxmox_pct_remote",
      "ansible_pct_vmid": 210,
      "tags": [
        "terraform",
        "container",
        "media",
        "download",
        "vpn",
        "torrent",
        "indexer"
      ],
      "node": "pve2",
      "pool_id": "media"
    },
    "sonarr": {
      "vmid": 211,
      "ip": "192.168.0.211",
      "hostname": "sonarr",
      "ansible_connection": "community.proxmox.proxmox_pct_remote",
      "ansible_pct_vmid": 211,
      "tags": [
        "terraform",
        "container",
        "media",
        "sonarr",
        "pvr"
      ],
      "node": "pve2",
      "pool_id": "media"
    },
    "radarr": {
      "vmid": 212,
      "ip": "192.168.0.212",
      "hostname": "radarr",
      "ansible_connection": "community.proxmox.proxmox_pct_remote",
      "ansible_pct_vmid": 212,
      "tags": [
        "terraform",
        "container",
        "media",
        "radarr",
        "pvr"
      ],
      "node": "pve2",
      "pool_id": "media"
    },
    "plex": {
      "vmid": 213,
      "ip": "192.168.0.213",
      "hostname": "plex",
      "ansible_connection": "community.proxmox.proxmox_pct_remote",
      "ansible_pct_vmid": 213,
      "tags": [
        "terraform",
        "container",
        "media",
        "plex",
        "streaming"
      ],
      "node": "pve2",
      "pool_id": "media"
    }
  },
  "vms": {},
  "docker_vms": {
    "docker-host": {
      "vmid": 250,
      "ip": "192.168.0.250",
      "hostname": "docker-host",
      "ansible_connection": "ssh",
      "tags": [
        "terraform",
        "cribl",
        "docker",
        "logging",
        "swarm"
      ],
      "node": "pve",
      "pool_id": "homelab"
    }
  },
  "splunk_vm": {
    "splunk": {
      "vmid": 200,
      "ip": "192.168.0.200",
      "hostname": "splunk",
      "ansible_connection": "ssh",
      "node": "pve"
    }
  },
  "constants": {
    "service_ports": {
      "haproxy_stats": 8404,
      "splunk_web": 8000,
      "splunk_hec": 8088,
      "splunk_mgmt": 8089,
      "cribl_edge_api": 9000,
      "cribl_stream_api": 9100,
      "apt_cacher_ng": 3142
    },
    "syslog_ports": {
      "unifi": 1514,
      "palo_alto": 1515,
      "cisco_asa": 1516,
      "linux": 1517,
      "windows": 1518
    },
    "netflow_ports": {
      "unifi": 2055
    },
    "notification_ports": {
      "mailpit_smtp": 1025,
      "mailpit_web": 8025,
      "ntfy_http": 8080
    },
    "vector_db_ports": {
      "qdrant_http": 6333,
      "qdrant_grpc": 6334
    },
    "media_ports": {
      "qbittorrent_web": 8080,
      "prowlarr_web": 9696,
      "sonarr_web": 8989,
      "radarr_web": 7878,
      "plex_web": 32400
    }
  },
  "domain": "jacobpevans.com",
  "host_services": {}
}
